{"$schema":"https://json-schema.org/draft/2020-12/schema","title":"Content Signal","type":"object","additionalProperties":false,"required":["schemaVersion","sourceEventId","sourceType","title","text","observedAt"],"properties":{"schemaVersion":{"const":"1.0"},"sourceEventId":{"type":"string","minLength":1,"maxLength":128},"sourceType":{"enum":["search_query","competitor_post","audience_question","support_ticket","sales_note","trend_snapshot"]},"title":{"type":"string","minLength":1,"maxLength":300},"text":{"type":"string","minLength":1,"maxLength":10000},"observedAt":{"type":"string","format":"date-time"},"sourceUrl":{"type":"string","format":"uri","pattern":"^https?://"},"audienceSegment":{"type":"string","maxLength":100},"engagement":{"type":"integer","minimum":0,"maximum":1000000000},"evidenceType":{"enum":["simulated","source_verified"]},"tags":{"type":"array","maxItems":20,"items":{"type":"string","maxLength":80}}}}
