{"schemaVersion":"1.0","sourceEventId":"cp-001","sourceType":"competitor_post","title":"Workflow reliability checklist","text":"A public competitor post discusses workflow monitoring and retry basics. This fixture is synthetic and is not scraped from a real platform.","observedAt":"2026-08-19T10:00:00Z","sourceUrl":"https://example.test/posts/cp-001","audienceSegment":"automation-engineers","engagement":240,"evidenceType":"simulated","tags":["monitoring"]}
