{"schemaVersion":"1.0","sourceEventId":"aq-001","sourceType":"audience_question","title":"How do retries and DLQs prevent lost automations?","text":"Our audience repeatedly asks for a practical zero-cost guide to retry, idempotency, and dead-letter queues in n8n.","observedAt":"2026-08-20T09:00:00Z","sourceUrl":"https://example.test/questions/aq-001","audienceSegment":"automation-engineers","engagement":18,"evidenceType":"simulated","tags":["n8n","reliability"]}
